{
  "schemaVersion": 1,
  "generatedAt": "2026-04-27T12:00:00Z",
  "stale": false,
  "selectedProvider": "codex",
  "daemon": {
    "version": "0.0.0-dev",
    "state": "degraded",
    "lastRefreshId": "fixture-refresh-missing-dependency",
    "lastRefreshStartedAt": "2026-04-27T11:59:58Z",
    "lastRefreshFinishedAt": "2026-04-27T12:00:00Z",
    "upstreamCli": {
      "path": null,
      "version": null,
      "available": false,
      "diagnosticCode": "fixture_cli_missing"
    }
  },
  "providers": [
    {
      "provider": "codex",
      "displayName": "Codex",
      "version": null,
      "source": "unknown",
      "sourceAdapter": "upstream_cli",
      "state": "missing_dependency",
      "updatedAt": "2026-04-27T12:00:00Z",
      "staleSince": null,
      "usage": {
        "primary": null,
        "secondary": null,
        "tertiary": null
      },
      "credits": null,
      "identity": null,
      "status": {
        "indicator": "missing_dependency",
        "description": "Fixture dependency is unavailable",
        "updatedAt": "2026-04-27T12:00:00Z",
        "url": null
      },
      "cost": null,
      "dashboardUrl": null,
      "diagnosticsSummary": "Fixture missing dependency state",
      "diagnosticCodes": ["fixture_cli_missing"]
    }
  ]
}
