{
  "schemaVersion": 1,
  "generatedAt": "2026-04-27T12:00:00Z",
  "stale": false,
  "selectedProvider": "codex",
  "daemon": {
    "version": "0.0.0-dev",
    "state": "degraded",
    "lastRefreshId": "fixture-refresh-provider-unavailable",
    "lastRefreshStartedAt": "2026-04-27T11:59:58Z",
    "lastRefreshFinishedAt": "2026-04-27T12:00:00Z",
    "upstreamCli": {
      "path": null,
      "version": null,
      "available": false,
      "diagnosticCode": "fixture_provider_unavailable"
    }
  },
  "providers": [
    {
      "provider": "codex",
      "displayName": "Codex",
      "version": null,
      "source": "web",
      "sourceAdapter": "linux_web",
      "state": "provider_unavailable",
      "updatedAt": "2026-04-27T12:00:00Z",
      "staleSince": null,
      "usage": {
        "primary": null,
        "secondary": null,
        "tertiary": null
      },
      "credits": null,
      "identity": null,
      "status": {
        "indicator": "unavailable",
        "description": "Fixture provider endpoint is unavailable",
        "updatedAt": "2026-04-27T12:00:00Z",
        "url": null
      },
      "cost": null,
      "dashboardUrl": "https://example.invalid/codex",
      "diagnosticsSummary": "Fixture provider unavailable state",
      "diagnosticCodes": ["fixture_provider_unavailable"]
    }
  ]
}
