{
  "schemaVersion": 1,
  "generatedAt": "2026-04-27T12:00:00Z",
  "stale": false,
  "selectedProvider": "codex",
  "daemon": {
    "version": "0.0.0-dev",
    "state": "ok",
    "lastRefreshId": "fixture-refresh-1",
    "lastRefreshStartedAt": "2026-04-27T11:59:58Z",
    "lastRefreshFinishedAt": "2026-04-27T12:00:00Z",
    "upstreamCli": {
      "path": "/usr/bin/codexbar",
      "version": "fixture",
      "available": true,
      "diagnosticCode": null
    }
  },
  "providers": [
    {
      "provider": "codex",
      "displayName": "Codex",
      "version": null,
      "source": "api",
      "sourceAdapter": "fixture",
      "state": "ok",
      "updatedAt": "2026-04-27T12:00:00Z",
      "staleSince": null,
      "usage": {
        "primary": {
          "usedPercent": 42.0,
          "remainingPercent": 58.0,
          "windowMinutes": 300,
          "resetsAt": "2026-04-27T15:00:00Z",
          "label": "Session",
          "detail": "58% remaining"
        },
        "secondary": {
          "usedPercent": 64.0,
          "remainingPercent": 36.0,
          "windowMinutes": 10080,
          "resetsAt": "2026-05-04T00:00:00Z",
          "label": "Weekly",
          "detail": "36% remaining"
        },
        "tertiary": null
      },
      "credits": null,
      "identity": {
        "providerAccountIdHash": "fixture-account-hash",
        "accountEmailDisplay": "masked-account",
        "accountEmailHash": "fixture-email-hash",
        "accountOrganizationDisplay": null,
        "accountOrganizationHash": null,
        "loginMethod": "api_key"
      },
      "status": {
        "indicator": "ok",
        "description": "Fixture provider is healthy",
        "updatedAt": "2026-04-27T12:00:00Z",
        "url": null
      },
      "cost": null,
      "dashboardUrl": "https://example.invalid/codex",
      "diagnosticsSummary": null,
      "diagnosticCodes": []
    }
  ]
}
